{
  "handoff_id": "HANDOFF-DEV-QA-KILOMENOS-16",
  "schema_version": "1.0.0",
  "timestamp": "2026-09-26T15:40:00Z",
  "sender": {
    "role": "Senior Android Developer",
    "agent_id": "senior_android_developer"
  },
  "recipient": {
    "role": "QA/Testing Engineer",
    "agent_id": "qa_testing_engineer"
  },
  "feature_id": "KILOMENOS-16",
  "architect_handoff_ref": "HANDOFF-ARCH-DEV-KILOMENOS-16",
  "remediation_cycle": 0,
  "implementation_manifest": {
    "module": ":core:infrastructure",
    "repository_class": "es.joshluq.kmsafe.infrastructure.repository.HistoryRepositoryImpl"
  },
  "code_changes": [
    {
      "file_path": "core/domain/src/main/java/es/joshluq/kmsafe/domain/usecase/AddOdometerRecordUseCase.kt",
      "action": "MODIFIED",
      "language": "kotlin",
      "line_count": 81
    },
    {
      "file_path": "core/infrastructure/src/main/java/es/joshluq/kmsafe/infrastructure/repository/HistoryRepositoryImpl.kt",
      "action": "MODIFIED",
      "language": "kotlin",
      "line_count": 343
    },
    {
      "file_path": "core/domain/src/test/kotlin/es/joshluq/kmsafe/domain/usecase/AddOdometerRecordUseCaseTest.kt",
      "action": "MODIFIED",
      "language": "kotlin",
      "line_count": 151
    },
    {
      "file_path": "core/infrastructure/src/test/kotlin/es/joshluq/kmsafe/infrastructure/repository/HistoryRepositoryImplTest.kt",
      "action": "CREATED",
      "language": "kotlin",
      "line_count": 181
    }
  ],
  "developer_test_summary": {
    "unit_tests_run": 10,
    "unit_tests_passed": 10,
    "unit_tests_failed": 0,
    "test_frameworks_used": [
      "JUnit4",
      "MockK",
      "Turbine",
      "kotlinx-coroutines-test"
    ],
    "test_files": [
      "core/domain/src/test/kotlin/es/joshluq/kmsafe/domain/usecase/AddOdometerRecordUseCaseTest.kt",
      "core/infrastructure/src/test/kotlin/es/joshluq/kmsafe/infrastructure/repository/HistoryRepositoryImplTest.kt"
    ]
  },
  "lint_and_sanity": {
    "compilation_clean": true,
    "ktlint_clean": true,
    "detekt_clean": true
  }
}
