{
  "$schema": "../schemas/dev_to_qa_handoff.schema.json",
  "handoff_id": "HANDOFF-DEV-QA-KILOMENOS-15-01",
  "schema_version": "1.0.0",
  "timestamp": "2026-09-26T01:40:00Z",
  "sender": {
    "role": "Senior Android Developer",
    "agent_id": "senior_android_developer"
  },
  "recipient": {
    "role": "QA/Testing Engineer",
    "agent_id": "qa_testing_engineer"
  },
  "feature_id": "KILOMENOS-15",
  "architect_handoff_ref": "HANDOFF-ARCH-DEV-KILOMENOS-15-01",
  "remediation_cycle": 0,
  "implementation_manifest": {
    "module": ":feature:auth",
    "entry_point_composable": "LaunchRoute",
    "viewmodel_class": "es.joshluq.kmsafe.feature.auth.launch.LaunchViewModel",
    "routes": [
      "es.joshluq.kmsafe.feature.auth.launch.LaunchRoute",
      "es.joshluq.kmsafe.feature.dashboard.DashboardRoute"
    ]
  },
  "code_changes": [
    {
      "file_path": "core/domain/src/main/java/es/joshluq/kmsafe/domain/model/AppOverlayState.kt",
      "action": "MODIFIED",
      "language": "kotlin",
      "line_count": 63
    },
    {
      "file_path": "core/ui/src/main/res/values/strings.xml",
      "action": "MODIFIED",
      "language": "xml",
      "line_count": 112
    },
    {
      "file_path": "core/ui/src/main/res/values-en/strings.xml",
      "action": "MODIFIED",
      "language": "xml",
      "line_count": 112
    },
    {
      "file_path": "core/ui/src/main/java/es/joshluq/kmsafe/core/ui/components/AppExecutiveHudOverlay.kt",
      "action": "MODIFIED",
      "language": "kotlin",
      "line_count": 705
    },
    {
      "file_path": "feature/auth/src/main/java/es/joshluq/kmsafe/feature/auth/launch/LaunchViewModel.kt",
      "action": "MODIFIED",
      "language": "kotlin",
      "line_count": 68
    },
    {
      "file_path": "feature/auth/src/test/kotlin/es/joshluq/kmsafe/feature/auth/launch/LaunchViewModelTest.kt",
      "action": "MODIFIED",
      "language": "kotlin",
      "line_count": 112
    },
    {
      "file_path": "feature/dashboard/src/main/java/es/joshluq/kmsafe/feature/dashboard/Contract.kt",
      "action": "MODIFIED",
      "language": "kotlin",
      "line_count": 60
    },
    {
      "file_path": "feature/dashboard/src/main/java/es/joshluq/kmsafe/feature/dashboard/DashboardScreen.kt",
      "action": "MODIFIED",
      "language": "kotlin",
      "line_count": 232
    },
    {
      "file_path": "feature/dashboard/src/main/java/es/joshluq/kmsafe/feature/dashboard/DashboardViewModel.kt",
      "action": "MODIFIED",
      "language": "kotlin",
      "line_count": 193
    },
    {
      "file_path": "feature/dashboard/src/test/kotlin/es/joshluq/kmsafe/feature/dashboard/DashboardViewModelTest.kt",
      "action": "MODIFIED",
      "language": "kotlin",
      "line_count": 397
    },
    {
      "file_path": "app/src/main/java/es/joshluq/kmsafe/ui/navigation/AppNavigation.kt",
      "action": "MODIFIED",
      "language": "kotlin",
      "line_count": 481
    }
  ],
  "developer_test_summary": {
    "unit_tests_run": 15,
    "unit_tests_passed": 15,
    "unit_tests_failed": 0,
    "test_frameworks_used": ["JUnit4", "MockK", "Turbine", "kotlinx-coroutines-test"],
    "test_files": [
      "feature/auth/src/test/kotlin/es/joshluq/kmsafe/feature/auth/launch/LaunchViewModelTest.kt",
      "feature/dashboard/src/test/kotlin/es/joshluq/kmsafe/feature/dashboard/DashboardViewModelTest.kt"
    ]
  },
  "lint_and_sanity": {
    "compilation_clean": true
  }
}
